{
  "screen": "special-empty",
  "version": 2,
  "dimensions": {
    "individualPetTruth": 25,
    "visualComposition": 20,
    "informationHierarchy": 15,
    "surfaceGovernance": 10,
    "contentPurity": 10,
    "interactionTruth": 10,
    "accessibility": 5,
    "pixelStyleTruth": 5
  },
  "thresholds": {
    "pass": 85
  },
  "critical": [
    "empty.presence",
    "empty.content.purity",
    "empty.action"
  ],
  "checks": [
    {
      "id": "empty.presence",
      "dimension": "individualPetTruth",
      "points": 12,
      "description": "Empty 态：Pet Presence 存在",
      "check": {
        "kind": "element",
        "idPrefix": "pli.empty.pet"
      }
    },
    {
      "id": "empty.identity",
      "dimension": "individualPetTruth",
      "points": 8,
      "description": "当前宠物身份存在",
      "check": {
        "kind": "element",
        "idPrefix": "pli.today.identity"
      }
    },
    {
      "id": "empty.composition",
      "dimension": "visualComposition",
      "points": 20,
      "description": "Empty 主视觉结构（pet+why）",
      "check": {
        "kind": "element",
        "idPrefix": "pli.empty.*",
        "count": [
          1,
          6
        ]
      }
    },
    {
      "id": "empty.why",
      "dimension": "informationHierarchy",
      "points": 15,
      "description": "Empty 态：为什么为空",
      "check": {
        "kind": "element",
        "idPrefix": "pli.empty.why"
      }
    },
    {
      "id": "empty.surface",
      "dimension": "surfaceGovernance",
      "points": 10,
      "description": "大 Card ≤3",
      "check": {
        "kind": "surface",
        "max": 3,
        "minArea": 16000
      }
    },
    {
      "id": "empty.content.purity",
      "dimension": "contentPurity",
      "points": 10,
      "description": "Owner 文本无 raw internal terms",
      "check": {
        "kind": "text-free",
        "tokens": [
          "BW-",
          "OWNER_REPORTED",
          "STRESS_RECOVERY",
          "OPEN",
          "provider_",
          "model_id",
          "event_key",
          "PLI-"
        ]
      }
    },
    {
      "id": "empty.action",
      "dimension": "interactionTruth",
      "points": 10,
      "description": "Empty 态：一个主动作",
      "check": {
        "kind": "element",
        "idPrefix": "pli.empty.action"
      }
    },
    {
      "id": "empty.a11y",
      "dimension": "accessibility",
      "points": 5,
      "description": "主动作可访问",
      "check": {
        "kind": "element",
        "idPrefix": "pli.empty.action"
      }
    },
    {
      "id": "empty.truth",
      "dimension": "individualPetTruth",
      "points": 5.0,
      "description": "空态来自真实 runtime（无占位） (real data)",
      "check": {
        "kind": "text-free",
        "tokens": [
          "占位",
          "TODO",
          "placeholder"
        ]
      }
    },
    {
      "id": "empty.truth.style",
      "dimension": "pixelStyleTruth",
      "points": 5.0,
      "description": "无占位/空板书风格（style truth）",
      "check": {
        "kind": "text-free",
        "tokens": [
          "占位",
          "TODO",
          "placeholder",
          "coming soon"
        ]
      }
    }
  ]
}
